Username,Comment Time,Comment Text,Thumbnail URL,Number of Likes
Rao Junaid Iqbal,3 years ago,کیاں ہی بہترین انسان ہیں یہ اور کتنے بھترین طریقے سے روکا,,0
Jutt studio,3 years ago,Haris bai my cast alvi awan ,,0
DR2「Tasty」ī,2 years ago,"Sirf Andaaz e Beyaan Rang Badal deta hy
Warna Dunya ma koi Baat Naei Baat nh",,0
bs dogar,3 years ago,"love u brooooo mmmmmuuuuu
aaaaaaaahhhhh.....from saim ansari",,0
Saad Khan,2 years ago,There is one place that give you permission to enter and that is mosque and there are all people equal and they would give meal if you hungry and the owner of restaurant also go where the poor men go so don't say that guard is doing his job,https://yt3.ggpht.com/ytc/AGIKgqNYgMsBztB3YXdy2j1oK_APH2de6a15PHI5Dg=s48-c-k-c0x00ffffff-no-rj,0
sadar habibi,3 years ago,WOW,https://yt3.ggpht.com/ytc/AGIKgqNQnXjwRwFWYxghN9NjdGt5UTHRZITb6bI5J14a=s48-c-k-c0x00ffffff-no-rj,0
Mohammad Sohail,3 years ago,Super bhai,https://yt3.ggpht.com/ytc/AGIKgqOm40aBqHVG73cX8BF0btfQxRiKGaQR57ZoXQ=s48-c-k-c0x00ffffff-no-rj,0
Anne Frank,2 years ago (edited),"02:04 You were saying ""CHAWAL KHANA HAI "" in a dull manner 
Pls, Don't manipulate!",https://yt3.ggpht.com/ytc/AGIKgqMkwAo8PfW6d73fl-YWYxAWSUs994VnAQRI7vZGug=s48-c-k-c0x00ffffff-no-rj,0
CREATIVE IDEAS,3 years ago,Goood.......,https://yt3.ggpht.com/ytc/AGIKgqMezJLv2mXWJ32JZHzdzw4UTPrskbkinGuc5w=s48-c-k-c0x00ffffff-no-rj,0
Shoukat Ali,2 years ago,Wow,https://yt3.ggpht.com/ytc/AGIKgqPfQpFfEiFtvwOAzaBzfsktRMXhmXbfSDIJlJxG4Lg=s48-c-k-c0x00ffffff-no-rj,0
Ali Hassan,2 years ago,I LOVE YOU ️,https://yt3.ggpht.com/ytc/AGIKgqMKYbrB3sowZLa9ozcVluXk6TANfbs-ZQiUYhI_=s48-c-k-c0x00ffffff-no-rj,0
Amish Nadeem,3 years ago,Video k start ma hi rice bowl nazar aa gya ha or end ar kaha ha k resturant ka naam nhi aay ha,https://yt3.ggpht.com/ytc/AGIKgqNNvKa6AIAfwY4IgB0ZAmEPCFcY140EZKukMQjNQQ=s48-c-k-c0x00ffffff-no-rj,0
Knowledge & Spirituality + (ISLAM),2 years ago,You dont need to want this with a guard,https://yt3.ggpht.com/1yhpvw6NwJEujye-YIJckFLs_wLRxjptf9QagCJ3SfKEo95qnmi6zmKBQIcfi4E28N0QebudZ9o=s48-c-k-c0x00ffffff-no-rj,0
Abdur Rahman Al Ausy,3 years ago,Yee he reality bro,https://yt3.ggpht.com/TB4vVI4tMeX6wkdd-s6gdLSVMx7DS2JRgVNhby_PKtWfKbtOlIEj1E5JDRVoyRCPs0wrqEKr=s48-c-k-c0x00ffffff-no-rj,0
S E R A N 7,3 years ago,Watch man is human,https://yt3.ggpht.com/ytc/AGIKgqP3msTWTyz0Ue6EohcHDa9n6CbH1attEFrdyx6pYg=s48-c-k-c0x00ffffff-no-rj,0
Farah Murtaza,3 years ago,Commonsence yar ,https://yt3.ggpht.com/ytc/AGIKgqONMx5jxRYAd68g-SDcdoa0b-2Y7rZusC3JOA=s48-c-k-c0x00ffffff-no-rj,2
Kaywan Ali,3 years ago,We all are not nice to poor people my first time cry on a vidieo,https://yt3.ggpht.com/ytc/AGIKgqMJ_rHMDHMm4ZHubFqiTK_8iCQPY3OJMXea7A=s48-c-k-c0x00ffffff-no-rj,0
Siddique online,2 years ago,Zabar dast,,0
Eliza,3 months ago (edited),"Khabar mein toh kala gora garib aur Aamir equall rehte hai, dunia mein rehe Tak ee insan zaat kitna partiality  karta hai.",,0
daud ahmed,2 years ago,Good point,,0
Masti Zada,2 years ago,o yaar kamal karta,,0
Azad Asalm,2 years ago,nic bhai,,0
Status Bank,3 years ago,Terrorists Vs Norma person ,,0
Subhu Malik,3 years ago,No mistake of guard,,0
Abuzar Uddin,10 months ago,guard apni job ker rha tha bhai ... he was right .,https://yt3.ggpht.com/ytc/AGIKgqPKB0FYXWQbvtKVuEsj7CApb9ebxUW4xFz6FDZK6g=s48-c-k-c0x00ffffff-no-rj,0
Junaid Khan,3 years ago,wow,https://yt3.ggpht.com/ytc/AGIKgqMrxmFxpQDW0_5Vacdrs0jfYppguHF_JvxXNZadiw=s48-c-k-c0x00ffffff-no-rj,0
nadeem ali,3 years ago,Multinational companies servants and multinational corporations are bastred,https://yt3.ggpht.com/ytc/AGIKgqOPpc_NCMAAfTeAvfTccvkgExZUuRDfPiT4=s48-c-k-c0x00ffffff-no-rj,1
Abhinav yadav,3 years ago,did anyone focus the MAGAZINE of the gun..the guard has.... .. guard aisi bandook kaha se laya?,https://yt3.ggpht.com/ytc/AGIKgqOiuygxpzu8UDr3K7-rJ5khSNCmJp4_wF0qdeQ4uA=s48-c-k-c0x00ffffff-no-rj,0
sardar di sardarni sardar sardarni,3 years ago,Security guard ki galti nhi hai wo to deuty pr tha jaisa owner bolega vaise hi hoga bt gurd ne kuch b galt batmizi nhi ki iske liye salute hai gurd ko vaise kahan pr hai j restaurant,https://yt3.ggpht.com/ytc/AGIKgqOXAhBr8IfjlZZIMhEeR-EJeiv-VlwO7UouQf7z=s48-c-k-c0x00ffffff-no-rj,0
Naitik Rajput Vlogs,2 years ago,Good script,https://yt3.ggpht.com/sVBJ5THZz1-mUxKWVG07F9Zt7qdTI6In-btJuu-rtF_KgiBzSzlRkIOytqGMJ38LwY_5GJg6mKA=s48-c-k-c0x00ffffff-no-rj,0
Rizwan Ali,3 years ago,Good yahi hota ajkal,https://yt3.ggpht.com/F_qt0UcsI3ZWqwjjEM1hYtNJqPFjtgciHglNBg21bJ42aTEvzQIY3kCyJ24AejfxG97LWU3myQ=s48-c-k-c0x00ffffff-no-rj,0
Syed Younus,3 years ago,Asli garib woo security hai bhai,https://yt3.ggpht.com/ytc/AGIKgqO6dSVi9wbtc9ztzdYQ0Fv1yfVpGfOlnEy0gw=s48-c-k-c0x00ffffff-no-rj,0
Althaf Althaf,3 years ago,Super,https://yt3.ggpht.com/ytc/AGIKgqO5hQ5uAroUSZUnUY3galuEO8NU5eu8W4j_HXbF=s48-c-k-c0x00ffffff-no-rj,0
shaik rashid,3 years ago,and i will face these problem,https://yt3.ggpht.com/ytc/AGIKgqMqQAVDRDfnBBVnpAkyLvU3tv5iUL6ADz8KsQ=s48-c-k-c0x00ffffff-no-rj,0
Pruthvi,3 years ago,"Us guard ko use jaane dena chahiye tha. Wo uske huliye se uske pass paise hai ya nhi ye nhi bata sakta. Upar se wo bol bhi rha rha ki uske pass paise hai. 
'' never judge a book with its cover ''",https://yt3.ggpht.com/ytc/AGIKgqPgdVfnYst1f4kwjQjlCFNi4IVHs4j7W-DMOg=s48-c-k-c0x00ffffff-no-rj,1
Saweed Rahman,2 years ago,,https://yt3.ggpht.com/ytc/AGIKgqMYDwY5N2L_hwf6aHsVf-SwHvWNHS4c-6WGGQ=s48-c-k-c0x00ffffff-no-rj,0
ltzDom,3 years ago,"Toys in 2019: 10$
Same toy but has a apple stcker:500$",https://yt3.ggpht.com/ytc/AGIKgqNEaTcvfMEHIQ_T5aLTQHkvUz2Y7ZsWgtsGEaXQFA=s48-c-k-c0x00ffffff-no-rj,0
bijay agarwal,2 years ago,the gaurd is helpless,,0
punjab india india,3 years ago,Nc paji bot bot vdhaia Saab,,0
Joe Blow,2 years ago,Why isn't it in English!? Wtf!,,0
Gunjan Mandal,2 years ago,Aap ki acting bahut acchi lagi hai,,0
Abdur Rahman Ansari,2 years ago,Really very sad,,0
BlueJude,3 years ago,Put a English translation,,0
WAQAR AHMAD BALOCH,3 years ago,Good,,0
43 muhammed shahal,3 years ago,Bro he is only working there,https://yt3.ggpht.com/ytc/AGIKgqN-oqTZY0AsA_gyE-rSVHNLPZPhZYz2AWw5s41tNQ=s48-c-k-c0x00ffffff-no-rj,0
Shakeel Ahmed,2 years ago,"poor vs poor prank not poor vs rich ,guard hy mama owner ni",https://yt3.ggpht.com/ytc/AGIKgqMajT868eEKCGWTIgJkPpAGwXbjp_eMEP1CS7Xin4A=s48-c-k-c0x00ffffff-no-rj,0
tajammal hussain,2 years ago,"Guard have good behaviour but he is helpless, blame to owner of the hotel,",https://yt3.ggpht.com/ytc/AGIKgqNdbTGpwQ5ovVA1ZMEPRzo603Ra9g0lESZEeQ=s48-c-k-c0x00ffffff-no-rj,0
Mr. Dee,3 years ago,"Pakistani awam,  we are very narrow minded be humble and spread love and this gurard should be jailed for that, that's what they do in canada and america its discrimination",https://yt3.ggpht.com/tZTebMHFo4W3MPHzIa8vXr0dEJOVCkrlznDPplcURZ3JWi0zJRC4ZDaU4Sby3WBRkIOyoifi8bY=s48-c-k-c0x00ffffff-no-rj,0
just chill,3 years ago,Bohat hi achi video naic,https://yt3.ggpht.com/eXxOL0Mk5w-5yXCTxthkinOVT90__W1HqqRe0uwe1KPeCMPXfiJCE94oY2jf7SgVdLyj5vVc=s48-c-k-c0x00ffffff-no-rj,0
Sami Rehman,3 years ago,Guard was innocent,https://yt3.ggpht.com/SQVz6X347csFkVop7HIy8nrMBSAzgBFocS-mKRmtdKtBO3F1182LUbbdnFAqMa1IixvwGWAhNg=s48-c-k-c0x00ffffff-no-rj,0
fozan bukhari,3 years ago,guard banda kamal tha,https://yt3.ggpht.com/ytc/AGIKgqP1RqDBu_oLx7fHMfp6jQhV3jZmbxxvDl3oXw=s48-c-k-c0x00ffffff-no-rj,0
Hussain Ahmed,2 years ago,Soch badlo haram khuro I like it,https://yt3.ggpht.com/ytc/AGIKgqMmhMCQyFuwUQYZIIGRKuw5P4mzgArf_uVMrVjEbw=s48-c-k-c0x00ffffff-no-rj,0
taxis baba  🚕🚖 meme,3 years ago,Good,https://yt3.ggpht.com/RhD_N8SaJsTKx6frXWr2nT9YH30JETkndcuQ5pNBrHGdZDa04bd0O95W15g8rNsK_cMuitBpng=s48-c-k-c0x00ffffff-no-rj,0
nomi x,2 years ago,Good,https://yt3.ggpht.com/ytc/AGIKgqNnteor7VJKtaWHSYWMPjfk2XM6m2xIvOzvSA=s48-c-k-c0x00ffffff-no-rj,0
lemonade,2 years ago,This guard is a simple employe he dont have any kind of grade to argue with his boss becuz he will be out if he do so he is not missbehaving what he is doing is not his own will he is just following his boss order,https://yt3.ggpht.com/z14EaXbPpjhnR5BP7p9_wXQJVgHfAxSqrehUPF70y04KiGRomTQQODmmuRDXQydowTxlKXw1C0g=s48-c-k-c0x00ffffff-no-rj,0
Nomi Sahi,3 years ago,"یہ دنیا احساس کی نہیں
پیسہ ایمان ہے ان کا",https://yt3.ggpht.com/ytc/AGIKgqMObB28M8jKOdXp7NnhpTYBRG8NDP8d6JW6eI5D9A=s48-c-k-c0x00ffffff-no-rj,0
☆ℛ𝒜𝒱ℐ𝒮ℋℐ𝒩𝒢  𝒜𝒫𝒫𝒜ℛℐ𝒯ℐ𝒪𝒩☆,3 years ago,Good work haris beta,https://yt3.ggpht.com/ArwOSZptXO-0dXZmAIqt_-bu-WK3_c_nEMQhPkOskJAWSsxHsTC0Ad5lA7XbSOwjKwgp9nunvA=s48-c-k-c0x00ffffff-no-rj,1
jamshi hasbi Thazhe Koomully,3 years ago,മലയാളികൾ ഉണ്ടോ,,0
Sameed Ahmed Khan,2 years ago (edited),Insan ko dress se or appearance se judge nhn krte. Pendu or modern sb equal hen. Allah ese restaurants or shopping malls ke boss ko brbad kre. Ulu ke pathe hn sale. Allah kre ese owner ko electric shock se mot ajae abhi,,0
SIMPLE VILLAGE FOOD PAKWAN,2 years ago,good,,0
Saheem. Javied,3 years ago,,,0
Muhammad Usman,3 years ago,"Poor vs rich ki baat ni 

Naa hi SB poor achy hen or na rich burey hen apni apni tabiyat or nature hoti he hr insaan ki 

Guard ne bilkul thk kia Jo b kia 

Esey logon ko andr jaany den to WO dusron ko TNG krty hen or hotal ka image khrab hota he",,0
Ashutosh,2 years ago,Abhi aisa 5 star hotel mai bhikari ban ke jayega toh hotel ki bhi koi respect hoti hai aur koi bhi aadmi jo 5 star hotel mai jayega woh phata kapda pehen ke nahi jayega,,0
cupcake_hugs,3 years ago,Did anyone noticed that the guard threw his cap,,0
Saeeda Qausar,2 years ago,Why if the guard didn't allow him to go inside at least he could bring some food outside for him.,,2
Ryuu Koyazaki,2 years ago,"""Rich man""?? LOL, He's just wearing a t-shirt and a pants. How does that make him rich? LOL, this is more like ""poor"" looking guy vs. ""normal"" looking guy.",https://yt3.ggpht.com/ytc/AGIKgqPH3AbKV19uB9tWG6jQz3BDJiFSqM6mOhcLLA=s48-c-k-c0x00ffffff-no-rj,0
Waqas Vicky,3 years ago,"Guard khud majburi se nokri kr rha hota hy ,
Behter tha managers se kehty baqi msg acha tha",https://yt3.ggpht.com/ytc/AGIKgqMJKmohmzpASr0JLDCgXBeJAUkxfiZWsOUenL4jgEE=s48-c-k-c0x00ffffff-no-rj,0
Silent Killer,3 years ago,Oy bhai to great a,https://yt3.ggpht.com/ytc/AGIKgqN6qQy4-tssNPUYbO6pyDEyqx5WWtoqKYj1qQ=s48-c-k-c0x00ffffff-no-rj,0
WAQASWAKI SPAIN,2 years ago,"IF GUARD ALOW U TO GO IN 

PPL INSIDE GONA LAUGH IN U 

THTS WHY

IN OUR COUNTRY PPL R LIK THT",https://yt3.ggpht.com/ytc/AGIKgqPbtMRIhJ0MvszNfuA9pGUe3JFOGoQD2Ub99g=s48-c-k-c0x00ffffff-no-rj,0
Sunny Ch,2 years ago,Dekha...paiso ki taqat...,https://yt3.ggpht.com/ytc/AGIKgqOasRIaztVQ9TKv91Dwck1anxc9ibZhzDD65w=s48-c-k-c0x00ffffff-no-rj,1
Top News,2 years ago,Guard ki koi galti nahi wo to apni duty kar rahay hain..,https://yt3.ggpht.com/H2-uE-958vsu4kE5BAlP-9kjZCI3fQrVNJfP_TWkCvrwnoNTATL66mYXdB2Iel9rZB-5rGyg2Q=s48-c-k-c0x00ffffff-no-rj,0
Paywao,3 years ago,why you don't show the name of hotel,https://yt3.ggpht.com/ytc/AGIKgqP9kZmsXb4QHe4fH2KRUXtVdMznJDi57QWiOKdH=s48-c-k-c0x00ffffff-no-rj,0
Humaira Batool,3 years ago,ufff kya thought hy logon ki,https://yt3.ggpht.com/ytc/AGIKgqOZOTTRQSWSeSKGV-C9ZTK1WNvnYng_f_nt8w=s48-c-k-c0x00ffffff-no-rj,0
Suresh Kolli,3 years ago,"This is an absolute stupid experiment.  If you go with teared cloths , how can a guard can allow you to rich resturant . Infact guard didnt insult him , but try to divert him nicely without hurting him.",https://yt3.ggpht.com/ytc/AGIKgqN-p8-tWL1tzMGQ4v6eh0ayCqxJlztrGBth=s48-c-k-c0x00ffffff-no-rj,1
KC MO,2 years ago,"No point in this ""social experiment.""",https://yt3.ggpht.com/ytc/AGIKgqO-v8TfjtKEQJLbDAu4VLDLnpSqEGiMf10pvw=s48-c-k-c0x00ffffff-no-rj,2
Sono G,3 years ago,Many Video Dykh k Open Kiya or Kaha It Must Be Haris Awan,https://yt3.ggpht.com/ytc/AGIKgqOZLbBiEjVJ5BOVIWzjLt-LQQzy44v_vTA4jg=s48-c-k-c0x00ffffff-no-rj,0
Bharatvaaj,3 years ago,What was so rich in that white t shirt,https://yt3.ggpht.com/ytc/AGIKgqM74_3nBfthHkncC6fJzm2Ff62XST60-bZM38_-vQ=s48-c-k-c0x00ffffff-no-rj,0
Ra Jab,2 years ago,,,0
Jazee Khan,2 years ago,"Mr Haris, he did what he receives order from their seniors... and they are also very lower income guys... so plz if you want to get viewers or something bigger then plz go for corrupt system...
Don’t mind plz",,0
Dil E Islam,2 years ago,Music is prohibited in Islam so plz avoid kiya kry,,0
Mano Mano,3 years ago,Goood,,0
Travel Buddies - Travel with Me,2 years ago,Garib sir late and chate khata hai reality hai..tu v apne ghar mai nahi ane dega camera off hote he..Garib hai sahab garib he rah jata hai :(,,0
MOTIVATIONAL FALCON,3 years ago,Zbardast,,0
Raju Kahlon,2 years ago,Dera Baba Nanak thank you,,0
Muhammad Asif-bin- Muhammad Zafarullah Khan,3 years ago,Guard sahi bol Raha hai,https://yt3.ggpht.com/ytc/AGIKgqO2ihTbJsIFSS8oGPNJsutM0N1mGRjlZTMRKFnn890=s48-c-k-c0x00ffffff-no-rj,0
Introvert 🙃,3 years ago (edited),"Obvsly yar gareeb ameer b kuch hota hai, tum unki charity me hissa leskty thy  tub wo mana nhi krta",https://yt3.ggpht.com/cwaaIQkFTVMx5mqXq6CR0jcQhBRMfR1-FPP7sbvESl7dKcnJcPBtVDZSxB4lDSPe0uK5xnav3g=s48-c-k-c0x00ffffff-no-rj,1
HYPER GAMING,3 years ago,;),https://yt3.ggpht.com/ytc/AGIKgqMoz0DRiLTYd6VoyD-QsxasXf1EhyzAfIAFdg-GiQ=s48-c-k-c0x00ffffff-no-rj,1
Anon A,3 years ago,Why are you harassing a watchman?,https://yt3.ggpht.com/ytc/AGIKgqMiOVvfIYCrny1Ra1-prpdxHKeQGZxb_muiOg=s48-c-k-c0x00ffffff-no-rj,0
zaid ali,3 years ago,Afsoos.,https://yt3.ggpht.com/ytc/AGIKgqMos-ZGGKzUUzfQdWVy0MrFLy-lzI9P3UkRTxHx=s48-c-k-c0x00ffffff-no-rj,0
Santhosh George,3 years ago,Very sad,https://yt3.ggpht.com/ytc/AGIKgqPI2vGglZ_q4q1A-qUaGrn-0CtbyuZgXSmZWw=s48-c-k-c0x00ffffff-no-rj,0
Man Sports,3 years ago,Vry sad,https://yt3.ggpht.com/ytc/AGIKgqPi2d-XGjyD4cwUMUBqQKZc-XH3MstUbdm8kTk-sQ=s48-c-k-c0x00ffffff-no-rj,0
syed hasaan,3 years ago,,https://yt3.ggpht.com/HbfBL6nBoCTDkilBYEUUHCBsZxzS0vftDkU0h-5Rp60RqxvTLZZs-ykN5JzNiCrhkBL4_O8g=s48-c-k-c0x00ffffff-no-rj,0
Shubhanshu Shukla,3 years ago,Galti kisi ki nahi bhai paise hi sab karvata hai,https://yt3.ggpht.com/ytc/AGIKgqPAsDk7u7VLavOQEYynXxiFljcOm5H0AofDrA=s48-c-k-c0x00ffffff-no-rj,1
Ahsan Rajput,2 years ago,Bhai ap ki video bari achi hoti hai main Sab video dekh ta ho,https://yt3.ggpht.com/ytc/AGIKgqMDyT0AojlqKGqdTLwqhwsSnBWtnew9gWJhHj8D4g=s48-c-k-c0x00ffffff-no-rj,0
Muhammad Kashif,3 years ago,Ye mulk hai hi ameeroon ka . ghareeb to ghulam hai,https://yt3.ggpht.com/ytc/AGIKgqNgDoNUhIwwKGmv6aLrJ-SVKQZzq2CggnCK2g=s48-c-k-c0x00ffffff-no-rj,0
Heaven Mind,3 years ago,Bad Prang ...Gard is honest,https://yt3.ggpht.com/LR0jBWsW5zuWdL4y4pqipvxZKFThbFpfl3ibXlO_ZtG4HDMZNOAcBephfGR202qGPm3OAHaLzg=s48-c-k-c0x00ffffff-no-rj,0
Geobuttternutter,2 years ago,Look it looks bad on the restaurant if they let someone dirty in put all other customers off,https://yt3.ggpht.com/ytc/AGIKgqONoK6SOsNUS8Fx6UqhOWLAfvRdp9SMOBKsUJ0Hfzu9Ld276fINMh4E_wymGC-A=s48-c-k-c0x00ffffff-no-rj,0
Divya Baburaj,3 years ago,Bhai ye security kam apkarthe app kya karega.. bhol.. same job ok.. hero security kithna pyarse bhath karthe degha.. app hogayatho..... love from india..,,0
irfan ikram,2 years ago,,,0
Akash Ashir,3 years ago,But jaga ka mujy pata chal gya  (the rise bowl) johar town !!!!,,1
MaSaIr HuNtInG ClUb sheikhupura,2 years ago,I like you,,0
Raja Lakshmi,3 years ago,Hate in rich,,0
Adil Aminkhan,3 years ago,Gaurd bhot Acha banda tha qu k woh janta tha k yeh ghreeb hy woh bhot pyar say usay samja raha tha k usay feel bhe na ho aur woh bhir say sasty hotel say khana kha lay idar say khain iss ko khana khany k bad bartan na dhony per jain.,,0
Shaik Ibrahim,3 years ago,Security guard ki galthi nahi hai uski job but bahot galath hai har kisiko restaurant me aneka mouka deo bhai tab hi hamara india ..india kahelayega 20-01-20...,,0
kochy Khan,3 years ago,Bodyguard ki Salu bahut acchi Thi aapke sath,https://yt3.ggpht.com/ytc/AGIKgqPv5qN393T80In5jrsXYaK119NMZnDgmLmnVQ=s48-c-k-c0x00ffffff-no-rj,0
innovative girl,2 years ago,,https://yt3.ggpht.com/ytc/AGIKgqNEfiLCUZq5X-kp471f9tt2JwRSqk4PMRdusg=s48-c-k-c0x00ffffff-no-rj,0
ANNshorts,3 years ago,who remember story of bhalool dana sahab,https://yt3.ggpht.com/bisZ9pPfnWxS9ryKHP07IQQvEWR-kfQRa40YMpnpoRCow9w9KGzzmEUyVoFiinJkVvZtCLVL=s48-c-k-c0x00ffffff-no-rj,0
MzCHANNEL8,3 years ago,Haris bhaiiii,https://yt3.ggpht.com/2GWadO9EfO82nt2CbjKaG6cx71RSKv5_afT1Ot1iqIDNxwFB36nMenOU-AxfUk0C17IbwKg7Kw=s48-c-k-c0x00ffffff-no-rj,0
MoviesLess,3 years ago,Bhai ya pakistan ha yaha ghareeb ki nh paisay ki izaat ha bhao,https://yt3.ggpht.com/CZ_uL_tprtu6272gCWGC5UsSsX7Jlm93-ygutqLiLYxoptBT3vuQuNfR_3U0w-GueB-xzFD4wyk=s48-c-k-c0x00ffffff-no-rj,1
mohanlal lamba,3 years ago,,https://yt3.ggpht.com/ytc/AGIKgqNOqiR3FdQCCldjZJg96GcidRguDywlW44k_05f6Q=s48-c-k-c0x00ffffff-no-rj,2
sonia sajid,3 years ago,Wah g ya sb sa achi chez ha. Tiktok sa bot bahtr ha,https://yt3.ggpht.com/ytc/AGIKgqP1Bgro8FcjzjbV9gghquYnbj2u2Bn_geP2vw=s48-c-k-c0x00ffffff-no-rj,0
Muhammad Raza,2 years ago,the guard was right,https://yt3.ggpht.com/ytc/AGIKgqPuAniVtqe0Ax5B41dvExwlQyadA_LONBe5TgV9BKc=s48-c-k-c0x00ffffff-no-rj,0
Gami Gam,2 years ago,"Helped me helped my family we are poor and I want to change our life, funded my transport project in my country please",https://yt3.ggpht.com/ytc/AGIKgqNqGhXykZkZGodUTPbdfuyaSMUXz1WALu02jFCDfg=s48-c-k-c0x00ffffff-no-rj,0
Nomi Sahi,3 years ago,,https://yt3.ggpht.com/ytc/AGIKgqMObB28M8jKOdXp7NnhpTYBRG8NDP8d6JW6eI5D9A=s48-c-k-c0x00ffffff-no-rj,0
PRO IS LIVE,2 years ago,noice,https://yt3.ggpht.com/ytc/AGIKgqOnDP_8XCWCqpI37jH66tscRW80h_eCELCiS6u22A=s48-c-k-c0x00ffffff-no-rj,0
Ayaan,3 years ago,This is not right.If you go in a fancy restaurant looking like a beggar then no one will in their right mind will let you in.No one is misbehaving if that don’t let you in.Its just a global policy,https://yt3.ggpht.com/ytc/AGIKgqO722L_bFI47P4QVQGgQQ-e0DbX-WgEl0aHtQaYO9uNaM7V0ObgZSGxvMbPI7l_=s48-c-k-c0x00ffffff-no-rj,0
Suraj Kumar Gupta Lakhisarai [S K G L],1 year ago,Bhai aapka subscribers bahut kam hai,https://yt3.ggpht.com/J-2kgKxZNZywAVfteknE2MF5-x1zb570csSXiPkgij3CW3ZSDMg4M8bpkVF1f7_XHySJdZo9z7M=s48-c-k-c0x00ffffff-no-rj,0
first name last mane,2 years ago,,,0
ASAD ULLAH,3 years ago,A1,,0
Abdul Rehman,3 years ago,"Yaar is guard ki koi galti nahi....
Haris bhai apko us becharay ki bayizaati nahi krwani chahiye th....",,0
ßxd-Clix,3 years ago,Plz translate,,1
k a,3 years ago,Guard is right,,0
Arjun Book Reviewer,3 years ago,But why does gaurd having the gun??,,0
Rahul Mohandas,3 years ago,Don't go to that hotel,,0
Ibrahim Akbar,3 years ago,Kamal,https://yt3.ggpht.com/ytc/AGIKgqOWAPGMDkRH6DBe3e79yjTidqlm03eA7DUB7w=s48-c-k-c0x00ffffff-no-rj,0
danish khan,4 months ago,Aaj kal paison Kay Saath bhi or theek clothes pehankay bhi jaey or Kam paison Ka khana khanay pay normal hotels waalay zaleel kartay hooting kartay taunt kartay ghurbat Ka or buray haalat Ka mazak urtatay it's dam true,https://yt3.ggpht.com/ytc/AGIKgqNkR_-sZop_zucqbJqo4SBGBY2yVNs7NZd67nHo=s48-c-k-c0x00ffffff-no-rj,0
OP Vincenzo,3 years ago,,https://yt3.ggpht.com/ytc/AGIKgqNDMFNhS1OCnKh3IBLzxJ5Zdxh0jKhpeV6agXyK=s48-c-k-c0x00ffffff-no-rj,0
hsn__ln,2 years ago,Yooo I'm a awan tooo,https://yt3.ggpht.com/xk5YJ5g6e1Nq2pdqOvQfNexrXpfUm0gcY3Zw8yVDlXFOs_5un0oA3iTb1qisyIWkqf7JCRNcSQ=s48-c-k-c0x00ffffff-no-rj,0
Muhammad Riaz,2 years ago,Sad yr,https://yt3.ggpht.com/ytc/AGIKgqNSVn89ciBvMuUwj95gef_kuwo4SUUuJVKGbg=s48-c-k-c0x00ffffff-no-rj,0
Muhammad fida hussain,3 years ago,Ap ki bht video  dekhi aaa  par ye lajawab hai,https://yt3.ggpht.com/ytc/AGIKgqPxPo0ftauVeZerRpnKqIGepP4MxyrOB3D23t323A=s48-c-k-c0x00ffffff-no-rj,0
Yahya Butt 1728,3 years ago,"Pls Mary bayta  ny aik video baynae ha ousay watch karin 
Mujy vlogs  or funny videos dakhny k shoke ha so  ouse ny b although hlp bayna kr baad main show ki
I know its not perfect vdo but he is only nine years old mashaAllah 
So I think it's  his gud effort",https://yt3.ggpht.com/a6xojTP1cIxKCYK4Ff2aGqwTb5HUbr25V9qFC6JJhkEDuSnRdOuCPqE8MG03e4Px7aXtQ7jx9w=s48-c-k-c0x00ffffff-no-rj,0
voice of mohsinbaloch,3 years ago,Gurd  so  nice  men  yr  asa  nh  krta  kisi  ka  sath,https://yt3.ggpht.com/ytc/AGIKgqMqPUBU5yGPPQ5GJXMhftMxPSa1hRm1pznS8Pd7=s48-c-k-c0x00ffffff-no-rj,0
Adilkhan Khan,3 years ago,Guard is right,https://yt3.ggpht.com/ytc/AGIKgqPHzioNY16yC-clYp_hLc85mpupnEGG1PKWNYjd=s48-c-k-c0x00ffffff-no-rj,0
Hamza Ijaz,2 years ago,allah o akbar  guard ko kabar me insect parey.inshallah,https://yt3.ggpht.com/ytc/AGIKgqOK6e8NOdYytUypqSa-JC2o1JBjc7aUotMZHw=s48-c-k-c0x00ffffff-no-rj,0
john hary,3 years ago,Watchman Shayad is liye hus ko reh raha hai yaha nahi miltha use laga ye afford nahi kar sakta aur huse heart break mni karna chahta ke huse kaita ke Yaha kana mahinga hai,https://yt3.ggpht.com/ytc/AGIKgqP4zwzOlCOPGv-aqBYGNi_zv2sket34sCLxsw=s48-c-k-c0x00ffffff-no-rj,0
Sanjida Laila,3 years ago,,https://yt3.ggpht.com/ytc/AGIKgqPPyZ7RbOGIdDRvY8cLVCrmCT16AjeqUBQqugXfjA=s48-c-k-c0x00ffffff-no-rj,0
Muhammad zafar7984,3 years ago,,https://yt3.ggpht.com/ytc/AGIKgqO3wYDyxwFNGFa6myaSOdlQcfIpYfqPnFFqzQ=s48-c-k-c0x00ffffff-no-rj,0
Love Edits,3 years ago,If poor humans. ..he guy's don't have money even he didn't go 5 star hotels. ......holy shit ppls,,0
abu zar imran,3 years ago,Log e you Harris Awan,,0
kako all gaming,3 years ago,,,0
Rabanu,2 years ago,Security sir was correct,,0
Satika Kalyan,3 years ago,Ap bi apna attitude dikhadiye na bhai last me watchman thanks bhi nahi bole,,0
HAIDER CREATION,3 years ago,You should not teach body guard beacause he is just doing his job,,0
Malik fahad,2 years ago,"Khuda ka khoof karo
Ye guard khud b gareeb ha",,0
Mohib Musaddiq,3 years ago,Security wale ne thik nahi kiye,https://yt3.ggpht.com/ytc/AGIKgqPdPl5JdInoeIaF8JyHCZcQjcR-bN6tydVjcgRj=s48-c-k-c0x00ffffff-no-rj,0
Muzammil Mursaleen,3 years ago,Deen-e-islaam sabko brabar haqooq dyta h. Guard ko jhoot bolny ki kya zroorat h wo saaf saaf bol day k mujy owner nay beggers ko ander aany say mana kia h. Allah pak inhy hidayat naseeb frmay.,https://yt3.ggpht.com/ytc/AGIKgqOu1f5jpbU1I_nFEBX9awpZ9sy8MGrShLZsgXAG=s48-c-k-c0x00ffffff-no-rj,0
manikanta kumar,3 years ago,,https://yt3.ggpht.com/ytc/AGIKgqPLk1KmIITDPjxPwfHnNSEdGBXDvo2hmrPhd7Oh0_0=s48-c-k-c0x00ffffff-no-rj,0
Awais Mushtaq,2 years ago,Good g,https://yt3.ggpht.com/ytc/AGIKgqPwhdrKT3U76zPZrllVP4gvY_0Du-rfwBPjjGDIig=s48-c-k-c0x00ffffff-no-rj,0
Machu222 Machu,2 years ago,Allah ka sath poora same he,https://yt3.ggpht.com/ytc/AGIKgqP9TQyFH88NAd0feOoDhMPI3Xhg75ChWipE7w=s48-c-k-c0x00ffffff-no-rj,0
MA TV,3 years ago,,https://yt3.ggpht.com/ytc/AGIKgqMUBhqIkQYYtFqk5SeLXiwD3o_a1xrBxePv6tq0qg=s48-c-k-c0x00ffffff-no-rj,0
sulman anwar,3 years ago,Guard apni duty kr rha hai,https://yt3.ggpht.com/ytc/AGIKgqPRXo7408KRc9j_QdijWTIRXLgUP062iOD-9ZuzoA=s48-c-k-c0x00ffffff-no-rj,0
Basheeer Ahmed,2 years ago,Guard was right bro,https://yt3.ggpht.com/ytc/AGIKgqPRGx7XxuMZt0hqhkiRzNnyL-5usO4ygCqEAw=s48-c-k-c0x00ffffff-no-rj,0
Travel Guy,3 years ago,"Its never happen in whole world . Even if you are a worker are your cloths are dirty. No one can humiliate you. You can go any ever.
West ko copy ker kay fakher mehsoos kernay waly es cheez ko.bhi copy karain",https://yt3.ggpht.com/ytc/AGIKgqOlwRSg03SGSjGgiHiNvBZ3QgPG2bAomAauL8tH=s48-c-k-c0x00ffffff-no-rj,0
Hammadkhan official,3 years ago,00:59 guard ne camera me dekha hahaha,https://yt3.ggpht.com/ytc/AGIKgqP5wR4Zfi2gMq5s5nNY8V1a0OYr4jA0ccBHLQ=s48-c-k-c0x00ffffff-no-rj,0
Usman Aslam,5 months ago,There is nothing special about such hotels anyway.,https://yt3.ggpht.com/ytc/AGIKgqMgUdEtz1HYIyxCwzkVQ013Ot0kFeYx5xKo9g=s48-c-k-c0x00ffffff-no-rj,0
Hassan mughal,2 years ago,Bhai ap car pe aatey tb seen daykhney wala hota....,https://yt3.ggpht.com/ytc/AGIKgqPSfZgV7isW4eUe5I7Pno7uY9kxhB7E9A9va1jC=s48-c-k-c0x00ffffff-no-rj,0
Who am I?,3 years ago,Apko gaurd ki nhi balkay gaurd ko owner ki complain krni chahiye... think,https://yt3.ggpht.com/ytc/AGIKgqO1OZfQt40PPSmBKg5_eeYeHpeQdEm29KjQG4zc=s48-c-k-c0x00ffffff-no-rj,1
Ghulam Shabir,3 years ago,Wa ji wa,,0
Gaurav Dhyani,3 years ago,"Security gaurd ki kya galti? 
Wo apna kaam kar raha he acche se
Koi or hota wo b tujhe rok deta bhai, wo b apna pet palne k lie naukri karta he",,0
U Tik,3 years ago,security wale ka qasoor ni h bhai mere,,0
Arish Naveed,2 years ago,,,0
Hamza Asim,3 years ago,,,0
Sohaib Arshad,3 years ago,please More,,0
Anonymous creep,3 years ago,"I like your social experiments but this wasn't really a good one. Better luck next time. You can't blame the guard, even the employees. They are just following instructions, otherwise they might lose their job. The guard was right to stop you. I will even say that he should've checked your bag too.",,0
Waheed Ahmad,3 years ago,Ghareeb ki koi izzat nhi hai,https://yt3.ggpht.com/ytc/AGIKgqONWxq6jWJo742psAMN4FoC5Na8gNPvrA7CoRl53A=s48-c-k-c0x00ffffff-no-rj,0
TODAY'S KID,3 years ago,Sad,https://yt3.ggpht.com/xAE2yfDbW1jd_Eojnbh4TjumJaYtw_Este6JPT-Pg2ZybSNfH5SJe35s2xmmcDexUcBwIzp5=s48-c-k-c0x00ffffff-no-rj,0
thenomiworld,1 year ago,,https://yt3.ggpht.com/md-b4XK4PgH3fdaejG7HHE04HqiDKgEpIYBve_p22j2K7tBw-YFejYZrOKVQEMOvOgSjEUH8=s48-c-k-c0x00ffffff-no-rj,0
Ahsan Raza,2 years ago,,https://yt3.ggpht.com/ytc/AGIKgqOKI9wHIGZ6eRmc8wjua5qpxz4GpVwa4uW3mXOp=s48-c-k-c0x00ffffff-no-rj,0
Iqra Zahid,2 years ago,Guard NY bilkul sahi kaha tha guard ki ghlati nhi h is m,https://yt3.ggpht.com/ytc/AGIKgqPyfOUaIn4W1vHeWQYFFD0FuSwyj9GVsvjCpQ=s48-c-k-c0x00ffffff-no-rj,0
Vignes Rao,3 years ago,Go fight with the owner who prepared such SOP for the guard. Dont be a coward,https://yt3.ggpht.com/ytc/AGIKgqPVSocUIjp0z3feI_WK0cyfiNTUahBeWmsm1A=s48-c-k-c0x00ffffff-no-rj,0
Raj Gaikwad,2 years ago,Bhai us bichareki nokri khatre mein aa jayegi,https://yt3.ggpht.com/ytc/AGIKgqMb7FsA7uiv3hQmSyvKlHKO0ZXU02Ccz8mPk9IyoA=s48-c-k-c0x00ffffff-no-rj,0
Ahmed Khurram,2 years ago,This  brand name is the rice bowl,https://yt3.ggpht.com/ytc/AGIKgqNTLXDPqOElvYdOfewt3uWnka3598ARUOI-hw=s48-c-k-c0x00ffffff-no-rj,0
