Username,Comment Time,Comment Text,Thumbnail URL,Number of Likes
khan,4 years ago,"Security gaurd was right he knows his best job, this was his job.",https://yt3.ggpht.com/ytc/AGIKgqMQ9zlPL2A45ifEggLI_7thJckG6OPiAAq0qu23pnpZatQFACiUgamq8bSnsN4p=s48-c-k-c0x00ffffff-no-rj,0
Movies HuB,4 years ago,Keep it up broh ,https://yt3.ggpht.com/zQNT3i6r54NOxOpFyFly5Pr8WUj30rHxMD2sZzjdmO7OZDuvG1YX5SlG2TQJG0s7mSX-O0QMbQ=s48-c-k-c0x00ffffff-no-rj,0
M.K.V.,3 years ago,"Love ur act bro...
Great job",https://yt3.ggpht.com/0u3Mwa74HVFe5VYQAQxYeaSB8_1JoajgOQ8i44Zn991x010ldqUaGSM3bfaIY60zzytu75DSag=s48-c-k-c0x00ffffff-no-rj,1
KPD Hacks,4 years ago,Respect For Guard,https://yt3.ggpht.com/ytc/AGIKgqOdtv2yMSW_EP3Sej9zYExXoAB7Lgj2SMR2P-0-=s48-c-k-c0x00ffffff-no-rj,0
Ashu Mehta,3 years ago,Guard was not wrong..He was just doing his job,https://yt3.ggpht.com/ytc/AGIKgqNzwLmGjQpQZNDHYAouvDA_RgWYpjaIn9uQ4w=s48-c-k-c0x00ffffff-no-rj,0
Spunky Rider,4 years ago,Nice bruh.... U r my fav u tuber,https://yt3.ggpht.com/ytc/AGIKgqO6lcviIml7kAn0Zy3HKTaNMDl5KYTg8is4rFA6KQ=s48-c-k-c0x00ffffff-no-rj,3
Ali Sabir,4 years ago,"Before judging the guard,  try to understand a message that Harris give us through this video.  The guard is helping him to eat something better and in reasonable price.  The guard knew that mac. is alot of waste money for him.  Don't hate the guard.  And good work Harris Awan",https://yt3.ggpht.com/ytc/AGIKgqOzvDxZ9aXDjwzSIgi0mY5kNmz-lmpKd_AVqrXBYA=s48-c-k-c0x00ffffff-no-rj,0
Hey hayaa.,4 years ago,Was waiting for thisss,https://yt3.ggpht.com/ytc/AGIKgqMIoAx3SWGQDZCo5NAwNzieyqJ9DN9lHn_OinC2=s48-c-k-c0x00ffffff-no-rj,1
Hassan Waseem,2 years ago,Nice video bro love you man,https://yt3.ggpht.com/ytc/AGIKgqNrb0VCHfiBNT-hHBFTSBT29Q3Q1hWTu6hu3Q=s48-c-k-c0x00ffffff-no-rj,1
Nisar Khan,4 years ago,Great job keep it up,https://yt3.ggpht.com/ytc/AGIKgqOKiInNZLt725O55IXLrW-yhJ2X9upz1_eKS7ahGgU=s48-c-k-c0x00ffffff-no-rj,0
DC Funny videos,2 years ago,Love you bhai form India keep it up Bhai,,0
Mohsin Ahrar,4 years ago,Good job bro,,3
Mishaal Khawar,4 years ago,He's so  soft spoken ...the guard,,0
Shehryar,4 years ago,The guard did what he was told to do. Can't blame him.,,0
Urwa Ali,1 year ago,Never judge a book by its cover,,0
ODISHA BHANDAR,4 years ago,Really I respect this guard.,,0
Adnan,1 year ago,Salute to the guard. That was not fair with guard.,,2
Shaurya Singh,3 years ago,This was not fair with the guard,,118
Tariqa Iqbal,4 years ago (edited),"It’s not actually the guard’s fault it is the society that should be blamed.
If he would have allowed u to go inside he would have lost his job,but still he was kind enough instead of pushing u and using harsh words his tone was polite enough.
I have witnessed it myself guards pushing the people away.
Usko becharay ko khud andar Beth k khane ki ijazat Nhi.",,0
Tooba R,4 years ago,in just love this vlog,https://yt3.ggpht.com/uAdQaV_2yIWPNQ3JzuSk26t4wBn-wNxI2wp1Lxyn1zMY59Kv9Y28oWQSerTSKB2MARU_DBUURHU=s48-c-k-c0x00ffffff-no-rj,0
Rurez,3 years ago,never judge the book by its cover.,https://yt3.ggpht.com/ytc/AGIKgqNHJcYJqZeNGUgt2pEfOwceScz33TaxRxWjXgiM_76nIkcdrqyip1KC7EOo8d5N=s48-c-k-c0x00ffffff-no-rj,0
Mohammed Amir Rafei,4 years ago (edited),"The guard did the right thing... a poor man will be able to afford better food somewhere else. a poor man wouldn't be happy to eat in this restaurant. This video doesn't picture anything wrong about the guard, rather his kindness and concern for the poor man.",https://yt3.ggpht.com/ytc/AGIKgqNNOV_Ps9d6Sp-kUuyOaWl7nd2JMwyotRSqJw=s48-c-k-c0x00ffffff-no-rj,0
haya Jaan,1 year ago,Kye message diye hai app ne maza aa.gaye dekh kar god bless you :-),https://yt3.ggpht.com/ytc/AGIKgqM86ZEg1GHUujJAWnuJkYZW75---Tn_GfVPMA=s48-c-k-c0x00ffffff-no-rj,0
Rabia Darr,4 years ago,"Its not at all that guards fault , obviously us gareeb ko jo us ka malik kahan ga us na wohi follow karna haiii , social experiment kisi ammer hotel ka owner ka sath karo to manan  this experiment was kinda weird ",https://yt3.ggpht.com/BODOs3kbE8MGhN5z-eU2djaRvE4BIJAvUtBFZfwt20rNdhqmso8S4OMt65JvMuCgCqyMxOOL-g=s48-c-k-c0x00ffffff-no-rj,19
Haseeb Rehman,4 years ago,that's was awesome ya cheez brother love you for this video,https://yt3.ggpht.com/ytc/AGIKgqN3x5AP1J3fDQjbOsT_dJv2I575JjQflvhxPyuruA=s48-c-k-c0x00ffffff-no-rj,0
Haider,4 years ago (edited),It's not about being broke. It's about wearing good cloths. If you go there to eat with those cloths. Some people might stop coming to that restaurant. Because they'll think it's a low class restaurant. I'm not supporting the idea but that's how society works now a days.,https://yt3.ggpht.com/ytc/AGIKgqPAjzFJ1gMta9Fos9P9G3dFraac4cqh8ihMz4HA=s48-c-k-c0x00ffffff-no-rj,0
Ahmed Bhatti,3 years ago,Its very sad but this happens all around the world...if u r dressed like junkie...you are not allowed plus many restaurant also have dress code that needa to be followed,https://yt3.ggpht.com/ytc/AGIKgqNcOIKsDafy_dhckzAQwsq1oPEx3GFSM7K__w=s48-c-k-c0x00ffffff-no-rj,0
Abdul Aziz,4 years ago,"Harris Bhai , acting to aap bohat achi kartay hay, great video , keep it up....",https://yt3.ggpht.com/ytc/AGIKgqMgGre6diES2BmMAy3PGnNvK0TmvREuisjhBQ=s48-c-k-c0x00ffffff-no-rj,0
D4KU-Z,3 years ago,Don't judge a person too quickly...,https://yt3.ggpht.com/XYWbW4vJGWcdu9e-PcIRhhsTKvP5XFcIv5PScRZLc-pwoU0H3T_dLpEL1VmPJYBM3PmveC-iPA=s48-c-k-c0x00ffffff-no-rj,0
Bigmac Tiger,3 years ago,"Watchman just did his duty.

And many of u people who think it’s very unfair: u guys won’t eat such place with ur families if the first kind of guy was let in.",https://yt3.ggpht.com/ytc/AGIKgqNgoGVeriuq5fb0NBC6W88_tUI5SDLEB2XeKzmM=s48-c-k-c0x00ffffff-no-rj,4
Muzammil Malik,4 years ago (edited),"that guard has done that right thing, honestly,at least he wasn't being rude or something, and was saying kal tumhy khilaon ga",,0
Alishba ch,2 years ago,The guard knew that the people inside would made fun of him ....,,0
R K,2 years ago,This is real truth in india. Insan ki nahi pasia ki chalti h.,,0
happy lyf,4 years ago,heart touching,,0
Mohammad Raza,2 years ago,Sad reality of our society,,0
Hello Mr,4 years ago,"I'm from India 
Nice video... ",,4
Hassan Ali,4 years ago,Guard treated with him nicely. Usually such people start begging inside and then guard is blamed for letting them in.,,0
abhishek bombale,4 years ago,He did his Job....uski kuch galti nahi hai wo konsa hotel ka owner hai he is just a watchman,https://yt3.ggpht.com/ytc/AGIKgqMVeRc9-cqO8HC8XP1cNRyXCrgtWcFW2FNbcg=s48-c-k-c0x00ffffff-no-rj,0
BD Nuruzzaman♪,3 years ago,Assalamu alaikum i'm bangladeshi i'm muslim i love you brother i looking this first your video sow.,https://yt3.ggpht.com/AqQYcqwXg3vVn9h-kwDXdEJGboUA-90T7WGuIT3tnKSy2FSNZDR3QnsR2foUSaq-LuKnuBKzpA=s48-c-k-c0x00ffffff-no-rj,0
Muneeb Khan,3 years ago,I would only be able to say#amazing,https://yt3.ggpht.com/ytc/AGIKgqNwiF2xrTcVkx5AjBy_dPI_y67iKAfmDmAsK0JU7klPwWFiW-MLLHBcKVCcbcWg=s48-c-k-c0x00ffffff-no-rj,0
Aylish Beauty Saloon,1 year ago,I really like your videos ,https://yt3.ggpht.com/D7LqRILU0RFho-5wfA3rYzbYaTQeK5NUyUuhsC12FiCvzYAUCMVM-W3odS19di-5pswFvwIoPAY=s48-c-k-c0x00ffffff-no-rj,0
zecrets,4 years ago,The Security Personnel was correct !! ,https://yt3.ggpht.com/BZKC6kqgPTSfg_nZpJ57Z02QWyNFddYDk8as0HfoxBp3VTGFdeDf3REtB0SzckK-Yw4SOADwd-A=s48-c-k-c0x00ffffff-no-rj,206
Tigress S k,4 years ago,Can’t really blame the security! They just doing their job,https://yt3.ggpht.com/ytc/AGIKgqOL5TzgKU4mWo_BrRjEy0s0bdoWko58WPGyY9r1=s48-c-k-c0x00ffffff-no-rj,0
Bharat 🇮🇳,3 years ago (edited),Security Guard ki koi galti nai hai. He was doing his duty. Uski bhi naukri ka sawal hai. But I respect he did not insult the begger. Not even a single word of disrespect. Haris you should apologize to him in person.,https://yt3.ggpht.com/Q4XkE9ibo_nPTFBZ_t5ya1mRn2VX7d8YKqZolEj8GHrKAlLljNJHqWzUnrI_WQpgd1bmnLyv=s48-c-k-c0x00ffffff-no-rj,0
Ayesha Sajjad,3 years ago,It's hilarious .. pakistan a peace country a sign of equality... did this type of inequality  Allah blessed our country (Ameen!),https://yt3.ggpht.com/ytc/AGIKgqP9pyI5qIBKpBOQBsdVbv9GiAYLfCnDXLS6tlEdlA=s48-c-k-c0x00ffffff-no-rj,1
Places to visit before you die,4 years ago,This breaks my heart,https://yt3.ggpht.com/ytc/AGIKgqMW8J91BJfszUmEaYPKwgIER1OCRrfHKjeFzg=s48-c-k-c0x00ffffff-no-rj,0
carry minati,2 years ago,"Love you bhai 
🇮🇳",https://yt3.ggpht.com/ytc/AGIKgqM5vTCorr4BvvHNiNVvfpd1B-5Mu5Pe6po7fYofTw=s48-c-k-c0x00ffffff-no-rj,0
Muhamamd gulshad,3 years ago (edited),Guard can be fired by his owner if he allow him to go inside,https://yt3.ggpht.com/ytc/AGIKgqMHinbtIg5Q_NhBh8AVufSix87vPJlXIv4x6g=s48-c-k-c0x00ffffff-no-rj,5
Farhan Ahmed,2 years ago,You can not blame the guard. The store manager is to blame and society.,https://yt3.ggpht.com/ytc/AGIKgqMTe19mJGoJ4GJNZ19FARshXt-CHNrFH3wKpgP79N0=s48-c-k-c0x00ffffff-no-rj,0
Dani Angel,4 years ago,Do more of these ,https://yt3.ggpht.com/ytc/AGIKgqMcNXo7ZRfnKXFDL62_hLj6OTzVcG0b7Pms2rUhhg=s48-c-k-c0x00ffffff-no-rj,0
Arslan Shafique,3 years ago,Great work,,0
H A S S A N,4 years ago,The guard did the right thing. He was a cool person,,0
SimplyFira,3 years ago,Confidence that you! I wish I had it,,2
Amazing Uttarakhand Rudraprayag,3 years ago,"Nice video 
I am from india 
Your video so Amazing supaabb",,4
Hassan Naveed,2 years ago,Guard has got some instructions from his managers. There is nothing wrong with guard.,,0
Muhammad Asif,4 years ago,Heart touching....,,0
Anwar Khan Anwar Khan,2 years ago,Nice video ,,0
Zahir Muneer torwali,4 years ago,Beautifull Amazing Videos Janab You Are Great,,0
QuiteDecent,3 years ago,"The title is in English, but there are no English subtitles or closed captioning...",https://yt3.ggpht.com/ytc/AGIKgqNBeRgd_o1gRyZ9xj92L8vtrzdl34VxP8vgwTTO=s48-c-k-c0x00ffffff-no-rj,0
sandeep satar,3 years ago,Instead of telling security guard name simply say what you did on before,https://yt3.ggpht.com/80YEtHEWj_afE4r6VRB3I7GtK0mN1tD4zbL9F7ncJNxIfFjxyDCTApaaP0OEwPKrKc422c59bXQ=s48-c-k-c0x00ffffff-no-rj,3
Bilal Khan,3 years ago,"Assalam o Alaikum
Guard ne bhout he ache tariqay se apni duty bhe k aur ghareeb ka dill bhe ni toraa

Lekin haris ne end pe hotel management se tou bhout tehzeeb se baat k lekin guard se rudly
So ghalat tou aap khud ho
I salute guard because of his good behaviour...",https://yt3.ggpht.com/CNcI27Phb6GdxkrCtzGVcQBCr_PUv923Zb3gphYQu24RPo6VbKlGW2BFbo9ikbjTUUhKE9446w=s48-c-k-c0x00ffffff-no-rj,1
Sk abid Sk abid,2 years ago,"He gave a very nice message. Brother Garib did not let him in. When he was dressed in a nice dress, he let him in. It was really very annoying.",https://yt3.ggpht.com/qDyThvrNUxWmfgrM-J0w3SLv1WsxDsjm7RPCsmzyfxfT_34ualKx2d-BQOtuWOV8ekRspTZ2Awo=s48-c-k-c0x00ffffff-no-rj,0
Ubaid Malik,2 years ago,Bohut acha Experiment tha Haris Bhai,https://yt3.ggpht.com/ytc/AGIKgqM6XLXCWdHB1sF434m5giGzoIRWesOmgljS-ckA=s48-c-k-c0x00ffffff-no-rj,0
manmeet singh,4 years ago,"This touch my heart, and now the respect for poor become more powerful singer ke liye koi like maangta hai aap dete ho , ek like for poor man k liye mai maang rha  hoon",https://yt3.ggpht.com/ytc/AGIKgqMShNV8nvXWqZQEZcG1oumYxVz1sxiInNHSqoxD=s48-c-k-c0x00ffffff-no-rj,5
Aksankhan askanKhan,3 years ago,Nice ,https://yt3.ggpht.com/ytc/AGIKgqMLtlvZKE6UQ48yP0CUEHrFKdZSoeur5B8z6A=s48-c-k-c0x00ffffff-no-rj,0
Zulfi Saiyyad,4 years ago,Koi ni Marne ke baad toh sabhi ek barabar ho jayenge ,https://yt3.ggpht.com/ytc/AGIKgqNsxBp5_Ih6Um7Tswwxt9FuLHyCqUsySF5bFw=s48-c-k-c0x00ffffff-no-rj,114
jude sumeda,2 years ago,"Guard did the best thing, he should not want that guy to go indise and get uncomfortable",https://yt3.ggpht.com/ytc/AGIKgqPl4fiWsZaKfL8oFBy8E0lbj-JR2DM4c6FAXw=s48-c-k-c0x00ffffff-no-rj,0
Zia Ahmad,4 years ago,"Guard to gareeb apni duty nibha Raha Tha
Ekin overall Great as always",https://yt3.ggpht.com/ytc/AGIKgqNX3omjnIimZu9epOth3mophmRN1ts1sHXnwqu2XQ=s48-c-k-c0x00ffffff-no-rj,0
sandeep roy,3 years ago,Guard is good he is just doing what he is told,https://yt3.ggpht.com/ytc/AGIKgqNKrnFrCHsrM4pi1T79keRsRvV2auNSFg-_8B_Npg=s48-c-k-c0x00ffffff-no-rj,0
Mohammad Saleem,4 years ago,,https://yt3.ggpht.com/ytc/AGIKgqNVrFoRdimG_Mq-dDiVRt-zrZKrRGLXIu7yZxSC=s48-c-k-c0x00ffffff-no-rj,0
R K FUNNY MIXER,3 years ago,Kamal hai yar ghareeb insan nhi hota kya. ......nice prank,,0
iam_zubysaifi,4 years ago,Mst Bhai superb ,,3
Prince Heart,4 years ago,"Guard is a really nice nd humble person..usna green bnda ki feelings ki qdr ki..insulted hna sa bchaya q k high class ma insult e hti uski.

Guard na kitna pyar sa uska dill dukhaya bina smjaya usa..",,0
Mishi Athwan,4 years ago,Speechless,,0
Moin baba,3 years ago,kamal kamaal haris bhai love you,,0
Gurvinder Multani,4 years ago,,,0
FRENZY JAGGI 👑,3 years ago,Love u Punjab Pakistaan..  my India Punjab,,0
ShortX,3 years ago,Sad reality,https://yt3.ggpht.com/LhutJ1Qzesvy27-7zbrH23K3Yd8HGF9M_hzvNJagCTidqdbs7oEycuX52cgTvn9kPrA9A-YWyyI=s48-c-k-c0x00ffffff-no-rj,3
ANGER GAMER,2 years ago,The guard is quite decent in his duty. He haven't insulted    haris before and after his reality. If he will allow beggars inside. He will be on fire frm his owner.,https://yt3.ggpht.com/OCR4x5bNuSoVeZ7MzbglagSnmHi6sqLj7v9nvKjdSEyQtaOZdQAtvtSujPx2gc31JsF0LolCHPI=s48-c-k-c0x00ffffff-no-rj,1
danalidahraj,3 years ago,Rights of admission reserved!,https://yt3.ggpht.com/ytc/AGIKgqN0pgZpEJKgsapkpwaKXAgKAJAWt-ZN1_obnQ=s48-c-k-c0x00ffffff-no-rj,0
Fit Beast_786,1 year ago,Guard Ko blame...Nhi Krna chahiye,https://yt3.ggpht.com/ytc/AGIKgqMR43hOwKiIa4Dx7k0h5VsF1hYP67x4pzhl5N9jzw=s48-c-k-c0x00ffffff-no-rj,0
Hasham Khan,2 years ago,Excellent...,https://yt3.ggpht.com/ytc/AGIKgqPK0fdmeGOkrPOuMKHpyUXhl7vAly8BbSGwGw=s48-c-k-c0x00ffffff-no-rj,0
Wasim Raheel Shahzada,3 years ago,Great msg brother,https://yt3.ggpht.com/ytc/AGIKgqPqpyJdJnZQRVV55j6zK4KZGmaq0hh9zYDsRhX0Rw=s48-c-k-c0x00ffffff-no-rj,0
Jay Anand,3 years ago,"Restaurant name "" The rice bowl""",https://yt3.ggpht.com/ytc/AGIKgqMNRIWal6Z176gvP3w_og6HY4pEMbLBR4qnTFTC_A=s48-c-k-c0x00ffffff-no-rj,29
BLOOOD BELL,4 years ago,More of this please!!,https://yt3.ggpht.com/ytc/AGIKgqO8LGR-Ad5Udk4qmaFunT1inPr_BroFZlYrpU5nuw=s48-c-k-c0x00ffffff-no-rj,4
Zoha Aamir,4 years ago,I mean obviously we shouldn’t discriminate between rich and poor but you can’t let a poor man dressed in torn clothes enter a restaurant it would be his own embarrassment along with the restaurant,https://yt3.ggpht.com/ytc/AGIKgqPGCZYrEPLFZktBn215v7t6bdoHVJ6P701GSQ=s48-c-k-c0x00ffffff-no-rj,0
Next One Channel,3 years ago,love you from Bangladesh 🇧🇩🇧🇩,https://yt3.ggpht.com/ytc/AGIKgqPjTrl5XGFigF6-RqcCm_Gl1ig-KY_m1fwrZVw2pA=s48-c-k-c0x00ffffff-no-rj,0
Artmash world,2 years ago,You troubled the security guard service  though he was kind to you.,https://yt3.ggpht.com/ytc/AGIKgqMVap3SdRYTNZ9LBa3uXmli6xmgXakSR5TYsA=s48-c-k-c0x00ffffff-no-rj,0
Mark,3 years ago,this made me cry,https://yt3.ggpht.com/ytc/AGIKgqOL-cKXcyDIV5x18_uMJg0qW5atlgM8h6ZZq4HGlfM=s48-c-k-c0x00ffffff-no-rj,1
Village TV,4 years ago, GREAT VIDEO ,https://yt3.ggpht.com/Bd8cXmekP5Adwl2iTftNRuEWIU3eULGOQADE5Gd7wLbF1y9Q202D_NifKnEIlyRxUr7mKrdU=s48-c-k-c0x00ffffff-no-rj,14
Dimple Doll,4 years ago,Apki videos kabest part y bhi h k ap funny videos k st st insaniyat par bhi videos bnty ho jisko dekh kr dil bhot khus hota h keep it up,,2
Dini Khan,2 years ago,Guard was saying I will feed you from my own pocket tomorrow did anyone notice that,,0
Saboor Wahab,3 years ago,Great job bro,,0
Thumblena queen,4 years ago,Wowwww yaarr ,,0
YaKu_,3 years ago (edited),"My favourite part:
00:00 to 3:20",,1
UNIVERSAL india,4 years ago (edited),"Superb. Bro..m a Indian..yaar. Pakistan ka. Ye. Wala. Face. AAP log. Samne la rahe. Ho by. You tube I salute you. Bro

Yaaar Pakistan Ko Badnam yuhi KR Rakha h..
Awam to hmare jaise hi h..",,5
Candice van der linda,4 years ago,it's not a very valid social experiment because the restaurants are privately owned and the owner/manager have every right to allow or disallow any individual or a group. people watch your videos so Mr AWAN please choose your topics in a way that some parts of community can understand the value of the other person's property. property includes almost everything not just a piece of land.,,0
Dead Star,2 years ago,Guard himself is a poor man ,https://yt3.ggpht.com/ytc/AGIKgqO0xOb9qYHBDpBM8sIluPt4wA_aEtn3gIlYysmd=s48-c-k-c0x00ffffff-no-rj,0
King Lion,3 years ago,Good bro you are having the talent of acting,https://yt3.ggpht.com/ytc/AGIKgqPOH1zH_CP3zwbCYIJFZYFqvtkiaan3hFzjHw=s48-c-k-c0x00ffffff-no-rj,0
GAB Egalan,2 years ago,Yeah we own a restaurant and we do not reject poor people we actually give them food and let them inside and eat free the guard lets them in,https://yt3.ggpht.com/ytc/AGIKgqOYYLI_19EbYrwupaMtlQGow3cm_MUbGE5i-NM8-g=s48-c-k-c0x00ffffff-no-rj,0
Khurram Khurram,3 years ago,Good job bro,https://yt3.ggpht.com/ytc/AGIKgqOYVpUAtlbSdrCRI7XZDk_lSvFRCiMf37JHtA=s48-c-k-c0x00ffffff-no-rj,0
Mandeep Rana,4 years ago,Gud job ,https://yt3.ggpht.com/ytc/AGIKgqN0HWmy1mxj28PUDV08aieyeSpwQCrehJfLwhwj=s48-c-k-c0x00ffffff-no-rj,5
Muhammad Athar,2 years ago,Dressing matter. Guard performs his duty well. Everyone should pay attention while going anywhere.,https://yt3.ggpht.com/ytc/AGIKgqPH9jx4tUMgB9sdDB2O6aL-RgVABEkqwIN3rCXJUZM=s48-c-k-c0x00ffffff-no-rj,4
IMMI Traveler,4 years ago,"Unfortunately, but Harris brother, you should have told this security guard that someone else does not do this with someone else. It's not a good thing you know",https://yt3.ggpht.com/ytc/AGIKgqP4D3i8DimQ7WGgYSaMlrc-6RpiVb2_iFZ5PQN7ZQ=s48-c-k-c0x00ffffff-no-rj,0
Yoel Cruise,3 years ago,Guards only obey orders from the owners...,https://yt3.ggpht.com/XpWiUwzaEU2zzr0QYHP9HaPzuqQBG5rerLsDZlQwXE2MX1aKYiyidWz7OlLbH86QY63itYMoWw=s48-c-k-c0x00ffffff-no-rj,2
Suraj Konnanath,4 years ago,"Poor watchman did nothing wrong..if he let the first person in,then he wud be fired for not doing his duty.. Bro u put his job under risk by telling them he didn't let u in.he  did look tensed bechara",https://yt3.ggpht.com/ytc/AGIKgqNrWUXzf5j7QQlf4YXvcP89widvVXW5d9adiTjY=s48-c-k-c0x00ffffff-no-rj,0
Murugan Senu,3 years ago,Poor people are very honest.......,https://yt3.ggpht.com/ytc/AGIKgqM9Twj91Sxmel85roH2jmE8SblHX3ZmJtYZ=s48-c-k-c0x00ffffff-no-rj,0
Jayvee Criss,4 years ago,I love Pakistan,https://yt3.ggpht.com/ytc/AGIKgqNX1Bso7YwoYNNAujqA0WD_3qVf9QgO52jfQHGjHA=s48-c-k-c0x00ffffff-no-rj,4
KaZim ArMaN,2 years ago,He do that because he was dependent. He was doing his duty it's not his fault it's our fault because we made inequality among us.,https://yt3.ggpht.com/ytc/AGIKgqMm0JHWxHZZjq9q7F5baoEst2wY8R9p84JomQ=s48-c-k-c0x00ffffff-no-rj,0
Philippe,2 years ago,The guard was very good.,https://yt3.ggpht.com/ytc/AGIKgqMKT4w1AkRoKnKUUnaqJe0oalJyIq4uaUa5zw=s48-c-k-c0x00ffffff-no-rj,1
Maaz Satti,3 years ago,Well done,,0
Murtaza Alam,1 year ago,I am with the security guard on this. He did his job....don't hold him responsible for societal ills. He didn't create those.,,0
Ayan Bali,3 years ago,Verry good Haris bhai insaniyat ase hi jagegi in paise walo ki,,0
Don't Miss Ltd.,4 years ago (edited),True is it.......our real life,,3
Salman Awan,4 years ago,"Yaar guard bechara b ghareeb aadmi hai, uska kia kasoor hai, he is only following orders aur apni duty kar raha hai. Right message, with the wrong execution. Tab b aapne effort ki wo b bari baat hai.",,0
Boineo mama,3 years ago,This is the fist I watch you youTube channel. I really appreciate the security for his hard work and politely spoke with even the poor person. He is following the order and follow the rules. Think yourself as the security person you may even slap him(honestly) Why...?? You earn money buy making videos on someone weakness. If the security is at your position he may give you good tips and hug you.,,3
motu patlu games world,2 years ago,Congratulations on 1 + MILLIONS SUB,,0
Rana Zubair,4 years ago,"تلخ۔۔
کمال کرتے ہو حارث بھائ۔۔",https://yt3.ggpht.com/ytc/AGIKgqMgwYb17AL5aw17Ruowuzxlrs-AanijPxbHu82y=s48-c-k-c0x00ffffff-no-rj,0
Orin Khan,3 years ago,Thug life bro,https://yt3.ggpht.com/ytc/AGIKgqNpCz8KqAbbnHR6Cjt1xlwYVJQGNrujpE54LefcmQ=s48-c-k-c0x00ffffff-no-rj,0
diya khan,4 years ago,Pakistan 🇵🇰 is the best,https://yt3.ggpht.com/ytc/AGIKgqMN9ZVRAUrQAjr7qiHIUgMPM9IE_gNSyAf7TWoe=s48-c-k-c0x00ffffff-no-rj,3
talha khan,4 years ago (edited),The guard did his duty well. Haris was being an ass.,https://yt3.ggpht.com/ytc/AGIKgqNULbXmeqTvV79-dRA2xRZ-ikrVSrrIcL9M3w=s48-c-k-c0x00ffffff-no-rj,0
Priv anon,4 years ago,Try doing something with management as they are teg ones who give rules like this to the guard,https://yt3.ggpht.com/ytc/AGIKgqN_9dNDZwMXyoCiEt_qFyWuZPX2Q0dZybYL9g=s48-c-k-c0x00ffffff-no-rj,0
Black Tiger,3 years ago,It's true and also bitter truth no body care poor people's even Just they give more and huge respect only richest people and they judging by people of clothes,https://yt3.ggpht.com/ytc/AGIKgqMH6GMZ8EFIXsHzAjLSYJ7gk8FbYgCZKEcT3WhM=s48-c-k-c0x00ffffff-no-rj,0
xxxdieselyyy2,4 years ago (edited),"I wonder if in medieval times, whether Central Asian raiders allowed poor people to also wallow in luxury whilst the plunder was ongoing to facilitate chaos  ???",https://yt3.ggpht.com/ytc/AGIKgqNG3dBLl_9irKtEg7Un5KlBn9dPQRJ4qyNHCg=s48-c-k-c0x00ffffff-no-rj,0
Faraz Ali,3 years ago,very very nice Harish bhai...,https://yt3.ggpht.com/cBuwJV3IKASUJtN8LyGpmBX3iDUuH25yPsG-Iwb_24VOoWaIuKWNJynKrZNTUXTfxXf18my34Q=s48-c-k-c0x00ffffff-no-rj,0
Vali videos 🌐,4 years ago,Agar e beggar ko andar bejdiya public feel uncomfortable n complain to the owner n he ll scold to the Guard..the problm is we the public..n our mindset,https://yt3.ggpht.com/u_6-SDMLgyMzI2sNezmyYvq1VY3Jn9yjhO14ER1DgbITGdB8Fkvr4114ZVOSAzEVbzMjnt79=s48-c-k-c0x00ffffff-no-rj,10
Kashmir vlogs,3 years ago,جب تک پاکستان میں یہ چیز ختم نہیں ہوگی ملک ترقی نہیں کرے گا اللہ پاکستان کو اپنے حفظ و امان میں رکھے,https://yt3.ggpht.com/ytc/AGIKgqPTFllWsNnc05mgvq2ppQ4ubB3Wotj4CH3mMum_=s48-c-k-c0x00ffffff-no-rj,0
Yasir Abbas,4 years ago,"Guard was right while performing his duties, this experiment was totally nonsense.",https://yt3.ggpht.com/ytc/AGIKgqMAtMDl2bje1FlX1fgjcaPTw2qPeHilNiKuWYddcA=s48-c-k-c0x00ffffff-no-rj,0
Allah Dita Allah Dita,3 years ago,Sch me Insaniyat B hr Insan me nhi hoti..,https://yt3.ggpht.com/ytc/AGIKgqPkmW-J_b33n8u8-UDTfCJgGk0j0hxeB5lC8Q=s48-c-k-c0x00ffffff-no-rj,0
inspirations inspirations,4 years ago,,https://yt3.ggpht.com/ytc/AGIKgqOmXvCgEt38etmFLezbxHRkY2cB4sDT3CAAVg=s48-c-k-c0x00ffffff-no-rj,0
Ghulam Sarwar,2 years ago,Guard was doing his duty,,1
Soumadip Banerjee,4 years ago,🇮🇳️🇵🇰️...,,132
ALI Waris,4 years ago,,,4
Funky Chunky,4 years ago,Gaurd was actually helping you  not to pay high money on food,,0
Akbar Abbas,3 years ago,bro you are amazing,,0
HAMZA JUTT,2 years ago,,,0
Rahul T,3 years ago,Very sad  🇧🇩🇧🇩,,2
Shubham xD,4 years ago,"Agar me tumhe bolu Kisi Aire gaire. Ko andar mat bhejo naito job se nikal dunga 
What will you do ... let someone go in????
Or Will Stop Think About Your Family And Stop Him...
Bro those security guards are poor don't make them feel bad",,18
Tahir MAHMOOD VLOG,4 years ago,اللہ پاک سب کا بھلا کریں بہت اچھا پیغام دیا ہے گاڑد بھائی بی اپنی جگہ بلکل درست ہیں اور دوسرے بھائی بی جو موقعے کی مناسبت سے درست ہے دونوں نے اپنی اپنی جگہ اچھا پیغام دیا,https://yt3.ggpht.com/ytc/AGIKgqNEcoFrJTk2KESYKOdCAt2WaHoq13l-UPVgMz1w8A=s48-c-k-c0x00ffffff-no-rj,0
izhar ul haq,4 years ago,بہترین حارث بھائی...,https://yt3.ggpht.com/ytc/AGIKgqN-bPB26GiWNk25cc6BBKV8xvS4Zfygj_jmbkGFLg=s48-c-k-c0x00ffffff-no-rj,0
Usama zai,3 years ago,amazing video,https://yt3.ggpht.com/ytc/AGIKgqN8lhnifaddCoWqjJ3-W9X6zqyGo2ditK8Spg=s48-c-k-c0x00ffffff-no-rj,0
sana perween,4 years ago,"The concept of this video is baseless. It's not that these guards intentionally don't allow poor looking people. They too are poor. They too know what its like be treated like a poor. They have a family to raise with their small income. They cannot afford to take such risk and get fired. It's the higher management that would have given strict guidelines to the guards. So instead of demeaning these innocent people, try to focus on the real culprits!",https://yt3.ggpht.com/ytc/AGIKgqOlbxSWF8quoAQd2LWHJRRvPognaOixPu-KR-BHBJM=s48-c-k-c0x00ffffff-no-rj,0
Aniket GAUTAM,3 years ago,Don't Judge A Book By Its Cover,https://yt3.ggpht.com/ytc/AGIKgqMtZfaMeiqH7fZEDvl0kQieGQ4I8wsk31l_7huX=s48-c-k-c0x00ffffff-no-rj,0
Royapuram rockers,3 years ago,I like this security. because its over job.,https://yt3.ggpht.com/ytc/AGIKgqNZI7bKfjtC_06Q-6S7qD0vU-ahO8oIjdz918fBAw=s48-c-k-c0x00ffffff-no-rj,29
MzCHANNEL8,3 years ago,Love you Brother,https://yt3.ggpht.com/2GWadO9EfO82nt2CbjKaG6cx71RSKv5_afT1Ot1iqIDNxwFB36nMenOU-AxfUk0C17IbwKg7Kw=s48-c-k-c0x00ffffff-no-rj,0
Banuk Baloch,3 years ago,Just subscribed ,https://yt3.ggpht.com/ytc/AGIKgqMtsQOVc1ZtKa11m8Rm1USYpu1eniMaXQ15K2pOew=s48-c-k-c0x00ffffff-no-rj,0
Ashfaq Ahmad,3 years ago,Mostly peoples spoke for security guard in comments and i against at ... Security guard give permission to him and onward this is management responsibility how they treat to him... But poor peoples don't give respect to Poor's.. and rich peoples give to Rich... I have so many experiences in Lahore how security guard treat me at gate of company....,https://yt3.ggpht.com/ytc/AGIKgqPq7W3HQjlkXqT4D17KpENKM5Er1UVEaDIWNU8pnA=s48-c-k-c0x00ffffff-no-rj,4
TVS GAMING,3 years ago,It happens only in Pakistan and undeveloped country not in India proud to be INDIAN,https://yt3.ggpht.com/3Rh0j3BOmmMQywwa5pUQO3-aKDKafrA1ozXh1f4iNWQcU0fwi1uUva_J5mAukb0F6tWuGFuOBg=s48-c-k-c0x00ffffff-no-rj,0
